{
  "version": "1.0.0",
  "generated_at": "2026-03-13T20:02:00Z",
  "timezone": "America/Los_Angeles",
  "window": {
    "label": "March 13, 2026 dispatch window",
    "start": "2026-03-13T00:00:00Z",
    "end": "2026-03-14T00:00:00Z"
  },
  "source": {
    "primary_table": "dispatched_tasks",
    "status_precedence": "observed_status_over_dispatch_status",
    "completion_fields": [
      "duration_seconds",
      "exit_code",
      "result_summary",
      "cost_usd",
      "commit_hash",
      "thread_ref"
    ]
  },
  "workflow": {
    "name": "Jaume > Paula > completion",
    "loop_note": "Jaume signs and dispatches. Paula executes on the Mac. Completion lands back in-thread and feeds the next dispatch.",
    "steps": [
      {
        "id": "jaume",
        "actor": "Jaume",
        "label": "Dispatch",
        "detail": "Creates the manifest, signs it, and posts the task into the orchestration thread."
      },
      {
        "id": "paula",
        "actor": "Paula",
        "label": "Execute",
        "detail": "Routes work to Claude Code or Codex, captures duration, git state, and completion output."
      },
      {
        "id": "completion",
        "actor": "Completion loop",
        "label": "Close the loop",
        "detail": "Posts the result back to the thread, persists task JSON and cost rows, and informs the next task."
      }
    ]
  },
  "tasks": [
    {
      "task_id": "task-20260313-193703-cost-infra-aud",
      "title": "Audit cost visibility infrastructure assumptions",
      "repo": "openclaw",
      "backend": "codex",
      "dispatch_status": "pending",
      "observed_status": null,
      "sync_state": "dispatch_only",
      "prompt_excerpt": "Trace the infra around cost capture and flag where the current pipeline can lose or mislabel spend.",
      "dispatched_at": "2026-03-13T19:37:03Z",
      "completed_at": null,
      "result_summary": null,
      "exit_code": null,
      "duration_seconds": null,
      "depends_on": [
        "task-20260313-193701-cost-plugin-aud"
      ],
      "dispatch_after": "2026-03-13T19:37:01Z",
      "manifest_message_id": null,
      "timeout_seconds": 300,
      "max_turns": 5,
      "cost_usd": null,
      "commit_hash": null,
      "thread_ref": "channel:1481145308007239820/thread:1481504470901551328",
      "requested_by": "Jaume",
      "assigned_to": "Paula"
    },
    {
      "task_id": "task-20260313-193701-cost-plugin-aud",
      "title": "Audit completion plugin cost extraction",
      "repo": "openclaw",
      "backend": "codex",
      "dispatch_status": "pending",
      "observed_status": null,
      "sync_state": "dispatch_only",
      "prompt_excerpt": "Review the manifest-dispatch plugin and confirm where cost_usd drops before CSV persistence.",
      "dispatched_at": "2026-03-13T19:37:01Z",
      "completed_at": null,
      "result_summary": null,
      "exit_code": null,
      "duration_seconds": null,
      "depends_on": [
        "task-20260313-193700-cost-verify"
      ],
      "dispatch_after": "2026-03-13T19:37:00Z",
      "manifest_message_id": null,
      "timeout_seconds": 300,
      "max_turns": 5,
      "cost_usd": null,
      "commit_hash": null,
      "thread_ref": "channel:1481145308007239820/thread:1481504470901551328",
      "requested_by": "Jaume",
      "assigned_to": "Paula"
    },
    {
      "task_id": "task-20260313-193700-cost-verify",
      "title": "Verify null cost rows against dispatch output",
      "repo": "openclaw",
      "backend": "claude",
      "dispatch_status": "pending",
      "observed_status": null,
      "sync_state": "dispatch_only",
      "prompt_excerpt": "Compare dispatch result JSON with cost-log.csv and confirm why total_cost_usd is not reaching the log.",
      "dispatched_at": "2026-03-13T19:37:00Z",
      "completed_at": null,
      "result_summary": null,
      "exit_code": null,
      "duration_seconds": null,
      "depends_on": [],
      "dispatch_after": null,
      "manifest_message_id": null,
      "timeout_seconds": 300,
      "max_turns": 5,
      "cost_usd": null,
      "commit_hash": null,
      "thread_ref": "channel:1481145308007239820/thread:1481504470901551328",
      "requested_by": "Jaume",
      "assigned_to": "Paula"
    },
    {
      "task_id": "task-20260313-160800-briu-live-cut",
      "title": "Prepare tighter Briu live cut for homepage and build",
      "repo": "briu-website",
      "backend": "claude",
      "dispatch_status": "pending",
      "observed_status": null,
      "sync_state": "dispatch_only",
      "prompt_excerpt": "Tighten the Briu live cut copy across homepage and /build without broad layout changes.",
      "dispatched_at": "2026-03-13T16:08:00Z",
      "completed_at": null,
      "result_summary": null,
      "exit_code": null,
      "duration_seconds": null,
      "depends_on": [],
      "dispatch_after": null,
      "manifest_message_id": null,
      "timeout_seconds": 300,
      "max_turns": 5,
      "cost_usd": null,
      "commit_hash": null,
      "thread_ref": "channel:1481145308007239820/thread:1481490029914417192",
      "requested_by": "Jaume",
      "assigned_to": "Paula"
    },
    {
      "task_id": "task-20260313-112800-security-crosslink",
      "title": "Add security methodology cross-links",
      "repo": "briu-website",
      "backend": "claude",
      "dispatch_status": "pending",
      "observed_status": "timeout",
      "sync_state": "completion_only",
      "prompt_excerpt": "Link the build security pages together and preserve the current information hierarchy.",
      "dispatched_at": "2026-03-13T11:28:00Z",
      "completed_at": "2026-03-13T11:38:00Z",
      "result_summary": "Timed out while reconciling overlapping links across security pages; no commit produced.",
      "exit_code": 124,
      "duration_seconds": 600,
      "depends_on": [],
      "dispatch_after": null,
      "manifest_message_id": null,
      "timeout_seconds": 600,
      "max_turns": 6,
      "cost_usd": 0.9554,
      "commit_hash": null,
      "thread_ref": "channel:1481145308007239820/thread:1481478824479225876",
      "requested_by": "Jaume",
      "assigned_to": "Paula"
    },
    {
      "task_id": "task-20260313-101100-client-loop-proof",
      "title": "Proof client feedback loop copy",
      "repo": "briu-website",
      "backend": "claude",
      "dispatch_status": "pending",
      "observed_status": "success",
      "sync_state": "completion_only",
      "prompt_excerpt": "Tighten the copy around comment-to-fix workflow proof without moving the page structure.",
      "dispatched_at": "2026-03-13T10:11:00Z",
      "completed_at": "2026-03-13T10:13:13Z",
      "result_summary": "Rewrote the proof section to emphasize auditability, approval, and close-the-loop execution.",
      "exit_code": 0,
      "duration_seconds": 133,
      "depends_on": [],
      "dispatch_after": null,
      "manifest_message_id": null,
      "timeout_seconds": 300,
      "max_turns": 5,
      "cost_usd": 0.4017,
      "commit_hash": "7b3ad12",
      "thread_ref": "channel:1481145308007239820/thread:1481467116301516890",
      "requested_by": "Jaume",
      "assigned_to": "Paula"
    },
    {
      "task_id": "task-20260313-091700-chart-label-pass",
      "title": "Normalize chart labels on build visuals",
      "repo": "briu-website",
      "backend": "codex",
      "dispatch_status": "pending",
      "observed_status": "success",
      "sync_state": "completion_only",
      "prompt_excerpt": "Clean up chart labels and mobile line wrapping on build visuals without touching chart data.",
      "dispatched_at": "2026-03-13T09:17:00Z",
      "completed_at": "2026-03-13T09:18:14Z",
      "result_summary": "Aligned chart labels, shortened long axis text, and tightened mobile spacing.",
      "exit_code": 0,
      "duration_seconds": 74,
      "depends_on": [],
      "dispatch_after": null,
      "manifest_message_id": null,
      "timeout_seconds": 240,
      "max_turns": 4,
      "cost_usd": 0.1435,
      "commit_hash": "59cc831",
      "thread_ref": "channel:1481145308007239820/thread:1481459913201102918",
      "requested_by": "Jaume",
      "assigned_to": "Paula"
    },
    {
      "task_id": "task-20260313-084200-build-feed-copy",
      "title": "Trim build page feed copy",
      "repo": "briu-website",
      "backend": "claude",
      "dispatch_status": "pending",
      "observed_status": "success",
      "sync_state": "completion_only",
      "prompt_excerpt": "Cut generic phrasing from the build page and make the dispatch section sound more operational.",
      "dispatched_at": "2026-03-13T08:42:00Z",
      "completed_at": "2026-03-13T08:43:34Z",
      "result_summary": "Removed generic AI phrasing and tightened the operational copy around dispatch transparency.",
      "exit_code": 0,
      "duration_seconds": 94,
      "depends_on": [],
      "dispatch_after": null,
      "manifest_message_id": null,
      "timeout_seconds": 300,
      "max_turns": 5,
      "cost_usd": 0.3128,
      "commit_hash": "e81d249",
      "thread_ref": "channel:1481145308007239820/thread:1481455520070418452",
      "requested_by": "Jaume",
      "assigned_to": "Paula"
    },
    {
      "task_id": "task-20260313-080400-dashboard-filter",
      "title": "Fix dispatch dashboard filter state",
      "repo": "dispatch-dashboard",
      "backend": "codex",
      "dispatch_status": "pending",
      "observed_status": "success",
      "sync_state": "completion_only",
      "prompt_excerpt": "Repair filter state persistence on the dashboard and keep the current card layout intact.",
      "dispatched_at": "2026-03-13T08:04:00Z",
      "completed_at": "2026-03-13T08:05:41Z",
      "result_summary": "Filter state now survives refresh and keeps the active tab highlighted.",
      "exit_code": 0,
      "duration_seconds": 101,
      "depends_on": [],
      "dispatch_after": null,
      "manifest_message_id": null,
      "timeout_seconds": 240,
      "max_turns": 4,
      "cost_usd": 0.1672,